reviewId,userName,userImage,content,score,thumbsUpCount,reviewCreatedVersion,at,replyContent,repliedAt,appVersion
ffe8a500-394a-44f3-a65d-237c11fbb480,Artur Malec,https://play-lh.googleusercontent.com/a-/ALV-UjUZpgMRVptyIGqpWX917lsM9cmMVcUIdwqEPbfX7rjXgw,"Szczerze mówiąc brak słów, dostawca włożył zamówioną pizzę do torby pionowo, dodatkowo jechał z nią ponad godzinę. Nie pozdrawiam i proszę o nie zamawianie ani nie korzystanie gdyż, support będzie zbywał i da tylko i wyłącznie możliwość zwrotu pieniędzy. Z wielką chęcią załączył bym zdj. Lecz niestety nie można :)",1,5,1.19.1,2022-04-03 22:14:10,,,1.19.1
410a5b72-f318-4dc1-89e4-26af25a5183b,Mateusz Godlewski,https://play-lh.googleusercontent.com/a-/ALV-UjXGfqrdeny8omCLSkQDgVGGEHUkgAAtHzAc_keSdeerCw,"aplikacja spoko, raz mi tylko dostawca przywiózł pizze pionowo...",5,4,1.19.1,2022-04-03 01:48:34,,,1.19.1
e1fd3b17-aefd-481b-b9d0-f853cbb707c1,Ane KuroMir,https://play-lh.googleusercontent.com/a-/ALV-UjXZckVXfLPZaeHHUi4cfDYVYilnssVXXfZz-GEZKKbNUuY,"Nie polecam, brak dostarczonego zamówienia. Zero konkretnego kontaktu.",1,11,1.19.1,2022-04-01 17:23:47,"Ane, można się skontaktować z nami przez aplikację. Proszę napisać reklamację - z pewnością ją rozpatrzymy.",2022-04-03 08:35:27,1.19.1
e7569893-910e-4693-8b89-f1715e14cde8,Irena Zalewska,https://play-lh.googleusercontent.com/a-/ALV-UjX2PJTEZomhELRNeH6RQPlJULF0wV62BONsFSzEO4bbkwM,"Był wcześniej dostępny Bolt Market z dostawą w okolicy mojego domu, z którego często zamawiałam produkty, teraz zabrano tą opcję i jest komunikat, że market jest zbyt daleko. Niewiarygodne!",1,6,1.19.1,2022-04-01 16:47:05,,,1.19.1
7cbb5e5e-0256-432d-af6d-1efcc801267d,Kasia,https://play-lh.googleusercontent.com/a-/ALV-UjVrDVbkbOOaN4rYJC9TjtlToOYfQOqRun_nVvyiKII3iEU,"Jedzenie nie dotarło mimo wielokrotnych telefonów do kuriera i jego zapewnień, że za chwilę bedzie. Najgorsza aplikacja do zamawiania jedzenia, nie polecam nikomu. Nie ma opcji zapłacenia gotówką, co by się przydało, skoro nie można ufać że jedzenie zostanie dowiezione.",1,0,,2022-03-31 23:31:58,,,
f6528fa5-6573-4654-8ac2-9184b628512b,Weronika Redzik-Nowak,https://play-lh.googleusercontent.com/a/ACg8ocJhO-mvaDJMdYDSIjJ-Hm_9iGUYnVtcmFcRRDeK5D7P=mo,"Nie polecam. Zamówienie było pomylone. Jedzenie było niejadalne wyglądało jak resztki. Jedyne co uzyskałam to zwrot 15 PLN na wykorzystanie u nich w aplikacji. Trochę słabo biorąc pod uwagę że wydałam więcej, a i tak zostałam bez jedzenia. Zero jakiejkolwiek odpowiedzialności. Jedynie komentarz ""mamy nadzieję że więcej się to nie powtórzy"".",1,2,1.18.1,2022-03-31 13:26:38,q,2022-03-31 13:59:16,1.18.1
23895e95-033c-4032-9eed-8753f71c4477,Maciej Luszczewski,https://play-lh.googleusercontent.com/a/ACg8ocIHo_o-Ipw-8Bo0yM_nvtEqeEAjwxP1N6nTyyfvuliQ=mo,Dwa podejścia dwa spalone jedzenie przyjechało zimne. Dostawcy nie ogarniaja.,1,1,1.18.1,2022-03-28 16:03:24,,,1.18.1
5ca02609-78d2-46f5-877d-3fceaa136513,Konrad Mucha,https://play-lh.googleusercontent.com/a/ACg8ocLajumBunqCy_JxKV1O_w7MGITcVhn1m1rxDOWXXodb=mo,"Pierwsze wrażenie - super, -20%/-30% zniżki na całe menu, czy darmowa dostawa mnie urzekły. Ale zaledwie po paru zamówieniach zrozumiałem sens tego - większość restauracji daje dosłownie wyższą cenę o te 20/30% żeby wpisać że mają promocję... Albo kebaby które są dwa razy droższe żeby im się opłacało. Dodatkowo pizza - rzadko kiedy można znaleźć taką pizzerię, która na promocji da ci wszystko na pizzy jakbyś zapłacił/a normalnie. Tak to dają jakieś ochłapy a ty masz się cieszyć że promka. Gunwo",1,3,1.18.1,2022-03-27 17:55:29,,,1.18.1
68da77e1-3c1d-4ca3-b099-8bcd067c223f,Sky Venom,https://play-lh.googleusercontent.com/a-/ALV-UjU62GBC6hmOHqQxrclYITJgk3ICJbWz9B0rx7BMKO0NTw,Hujnia,1,1,1.18.1,2022-03-26 22:19:14,,,1.18.1
3ae395b4-a291-4cea-9a58-5ab863c7139c,Mateusz Molenda,https://play-lh.googleusercontent.com/a-/ALV-UjXJzvxDwfG5tN7i2PVfrWdpYjubCcIoW7y6jgwcY75VkN0,"Dobór kurierów to katastrofa. Zamówienie do centrum Warszawy. Z lokalu trasa na 15 minut rowerem. Kurier (z krajów arabskich) błądził dookoła, nie potrafił dojechać na Krakowskie Przedmieście! Gość w ogóle nie zna miasta, nie wspominając o elementarnej znajomości polskiego. Zamiast dostawy pod drzwi, w końcu musiałem wyjść i szukać go po mieście, a czas dostawy przebił 2 GODZINY! I jeszcze miał pretensje, że marnuję jego czas 😂 EDIT: Pomoc od supportu jest sprawna i poprawia wizerunek firmy.",3,1,1.18.1,2022-03-25 19:37:20,,,1.18.1
b08b9112-b179-43c3-8d39-86e6b069d068,Fannzi,https://play-lh.googleusercontent.com/a-/ALV-UjXnhsoqz5i86PvhAVSA1-Akk8XCnkrAu_KUgkingGar0Mc,Bardzo podrożało,1,10,1.18.1,2022-03-25 19:12:33,,,1.18.1
fca7343f-6ffb-4b4b-bee7-79406e2e7440,Other Selkie,https://play-lh.googleusercontent.com/a-/ALV-UjV5719lnC7zYTGrd1fCBl7p-WH51naALr9LbACQbe87cA,Zostałam automatycznie wylogowana z aplikacji i już nie mogę się zalogować. Wolałabym móc dalej z niej korzystać. Nigdzie nie ma możliwości zgłoszenia błędu. Dzisiaj nie będzie jedzone.,1,1,1.18.1,2022-03-25 15:50:44,,,1.18.1
dc07cf2d-84c6-4fe2-91dd-b161b8ccef62,Krzysztof Morawski,https://play-lh.googleusercontent.com/a/ACg8ocJgDTXEYbah9Yvin-PFXu-9zLtm6mWrFMh3LW6r7CI7=mo,Za marżę dla restauracji,1,2,1.18.1,2022-03-22 07:46:05,,,1.18.1
30f427bc-691b-46c2-bf97-d2dbb92ce0a7,Błażej Kwacz,https://play-lh.googleusercontent.com/a-/ALV-UjXlCN03wl-pakgBoet1eIY2MigzsoZ0J9InezlC5GnKIiI,"Brak dostępu do mojej dzielnicy,mieszkam w Poznaniu,Dzielnica Antoninek ,Nowe miasto,mamy XXl wiek,coś słabo się rozwijacie...",1,3,1.18.1,2022-03-22 06:58:30,,,1.18.1
f61864a2-6bcd-4be7-8dc9-7dcb72531c79,Lech,https://play-lh.googleusercontent.com/a-/ALV-UjWOww4a-egkn3F8IvU7JXXVAmDuHfcV6skudeHPqf3tD47f,"Zainstalowane na dwóch kontach dwóch osób. Na obydwu nie działa, nie przechodzi zapłata (różnymi) kartami, a obciążenia na kartę wchodzą. Jakiś bubel.",1,2,1.18.1,2022-03-19 10:21:00,,,1.18.1
8c35a282-e800-448b-816e-16317f6bc90b,Ubruh „Uberosky”,https://play-lh.googleusercontent.com/a-/ALV-UjVPEJeh4Ub3B2PKL2ls3hRJ2TFuEj6vRjRSUB7eitBu1b8,Naprawcie tą aplikację bo nieda się karty nawet dodać więc jak ma ktoś zamówić cokolwiek...,2,3,1.16.0,2022-03-18 19:39:17,"Dzień dobry,

Dziękuje za skontaktowanie się z nami.

Aktualnie walczymy z błędem aplikacji, nasz zespół specjalistów już zajmuje się tą sprawą. Za wszelkie problemy z tym związane przepraszamy.

Pozdrawiam,
Andy

Bolt Food Support",2022-03-18 19:43:43,1.16.0
e3332c6b-312a-48eb-8652-22d9131b0c2c,Magdalena Komorowska,https://play-lh.googleusercontent.com/a-/ALV-UjUmzFAQZ_oO7i_ZS6-7al4n5CiI6bMlYOCXlxVBAJ06IE7w,"Aplikacja działa ok, ale sam koncept średni. Zatrudniają kurierów, którzy nie mówią po polsku, po angielsku też nie, potem dzwonią do ciebie, nie wiesz gdzie są, nie możesz się z nimi dogadać, szukasz ich po calym osiedlu. Bez sensu.",2,2,1.17.0,2022-03-17 13:57:41,,,1.17.0
bf665e42-4697-44c4-bea0-099f84b97f6b,Dawid Surma (Pompa papaj koksiu),https://play-lh.googleusercontent.com/a-/ALV-UjXan3pTeUlIP7epz4AuyORDKldJfbhG7L-MgSUxAonr038,"Zamówienie zgadza się, przyjechało szybko i ciepłe koło 30 minut",5,0,1.18.1,2022-03-16 19:35:07,,,1.18.1
b08e03c6-7126-4439-b5ea-7f43f45e3afc,Tomasz Żabiński,https://play-lh.googleusercontent.com/a-/ALV-UjVfoWXnKmHIIFPlNssyGmSvYE0H8shuG_A7RVFqg9wCB4w,Bardzo Dobre.,5,0,0.48.0,2022-03-16 13:21:19,,,0.48.0
3468a4ea-6b08-438f-bf91-6a1bec1ddf76,Ula Osada,https://play-lh.googleusercontent.com/a/ACg8ocLjJsP-1ux1AS7pAVzF_wFrJ3uccMQ8Tnl7XC7qI7AY=mo,Super apka,5,1,1.18.1,2022-03-15 11:42:37,,,1.18.1
9f1637aa-b94c-43e0-a569-da05d03aaf6c,Hubert K,https://play-lh.googleusercontent.com/a/ACg8ocLUKjn5cZgQ2pv6kf_0BVf9KfCqbIYGYZL2NhqdirI8=mo,Git,5,0,,2022-03-15 09:59:37,,,
5442b5d5-3f5f-4ea1-aed2-c83707eb2b69,Szymix :],https://play-lh.googleusercontent.com/a-/ALV-UjXtg25V2OQWywDbwC1BuPn7mrvCoddBpYar74Agj_4HSo8,Nie wiem skąd tyle negatywnych komentarzy. Zamawiałem 2 razy w Wawie bez żadnych problemów. Jedzenie przyszło ciepłe. Normalny czas oczekiwania < 1h. Do tego świetne promocje i ceny,5,2,1.18.1,2022-03-13 18:07:29,,,1.18.1
68b54f5d-ac64-4adc-90c8-35a052dcdd70,Marta Makowska,https://play-lh.googleusercontent.com/a-/ALV-UjXGcWZrIxCHwB2qCzqFZAH5HOzD5Jhb0vKj0nly-w_Yq7er,Tragedia. Kurier nas okradł.,1,2,1.18.1,2022-03-12 23:30:18,"Dzień dobry,

dziękuję za wiadomość. Bardzo mi przykro to słyszeć. Poproszę więcej informacji, ułatwi mi to rozwiązanie sprawy.

Pozdrawiam

Maja
Bolt Food Support.",2022-03-13 00:16:51,1.18.1
c2824261-e289-4e01-8dd6-a05e7bd3d95a,David S,https://play-lh.googleusercontent.com/a/ACg8ocKm2_AV1GPQfrZudMNolCQFJv9MnUJW3agqbhuSTA38=mo,"Kurier zrobil sobie 1.5h tour po mieście, support to nieśmieszny żart. Nie polecam i odradzam.",1,1,1.12.5,2022-03-12 17:25:24,,,1.12.5
5bccf1d0-599f-4821-9213-d44f784fec76,Martyna,https://play-lh.googleusercontent.com/a-/ALV-UjVWL3X6ug--P8NBpkpCurK3L9Hwe58JhEg64ny1EbyBprsL,"Kurierzy jeżdżą jak chcą-patrz stoją np 30 minut w jednym miejscu (w godzinach gdzie nie jest to kwestia ruchu drogowego) rozumiem raz, bo wypadek, awaria whatever. Ale nie ciągle. Zamówienia opóźnione nawet po godzinę. Jedzenie zimne bądź roztopione. Więcej nie skorzystam z aplikacji.",1,25,1.18.1,2022-03-09 19:54:40,,,1.18.1
42a4a784-02db-406a-a18f-89949e5d1473,Krzyś Musiał,https://play-lh.googleusercontent.com/a-/ALV-UjX08_O4oitSt6eEM9dBQU3TMC1qLETksR31aA0pp0AeVGw,Kurier dowoził nam jedzenie przez 1:30h z kebaba ktory znajduje się kilometr od mojego domu. Kebab przyjechal całkowicie zimny a support jedyną ugode jaką zaproponowal to zniżka na następne zamowienie w postaci części kwoty. Tragiczna Aplikacja nie zamawiajcie za jej pomocą,1,27,1.18.1,2022-03-08 23:55:10,,,1.18.1
4f0c6705-c036-4539-8ea5-717742b72560,Zeicc89,https://play-lh.googleusercontent.com/a-/ALV-UjV8PiPO_xMgxMhFq0xxFb3I49qJv1Hv4-FvHWeTvYgJ5oo,"Dostawa niedostępna z powodu dużego popytu albi nie ma kurierów. Poza tym w dostawcach rzadko trafi się ktoś mówiący po PL albo ENG żeby dało się dogadać czy instruować jk trafić. Support żenujący a do tego oszukują na rabatach. Miało być 50% na dwa pierwsze zamówienia, a okazało się że to tylko na jedno bo popełnili błąd. Regulaminu promocji nie ma, a support g może zrobić. Gorsze niż UEats, a to jest j...e osiągnięcie. EDIT: w ostatniej dostawie zamówienie przyjechało zimne. Dostawca pojechał naokoło a potem chyba z 7min szukał miejsca do parkowania, a wystarczy zostawić auto przed bramą, tak jak robią to inni. Amatorszczyzna. A, no i ceny za dostawę wzrosły drastycznie + rabatów coraz mniej. Z radością wrócę do zamawiania bezpośrednio w knajpie, żeby nie nabijać kieszeni takim miernym ""pośrednikom"". EDIT: Zatrudnijcie w koncu wiecej ludzi, bo co rusz - dostawa niedostepna z powodu duzego popytu. TO OD CZEGO WY JESTESCIE?! JAK WAM BRAKUJE RĄK DO PRACY TO DAJCIE IM DOBRE WARUNKI! Jakos Uber czy pyszne nie mają takich problemów. UCZCIE SIĘ!",1,17,1.18.1,2022-03-06 21:15:01,"Dzień dobry, bardzo nam przykro, że nie jest Pan zadowolony. Prosimy o zgłaszanie problemów na bieżąco z poziomu aplikacji, pod odpowiednim zamówieniem. Reagujemy na każde zgłoszenie, aby stale udoskonalać i podwyższać jakość usług. Pozdrawiamy",2021-09-16 12:46:32,1.18.1
c348d7c7-8a31-4a52-881b-8db146f894a1,Kamm Weryszko,https://play-lh.googleusercontent.com/a/ACg8ocKsFoQAjryus62EHQuuGe2ea62H5ydOEnxG5Yz48TZu=mo,"Kurierzy po prostu dają dostarczone a jedzonka nie ma, raz może się zdarzyć ale to chyba ich standard. Nie polecam",1,24,1.18.1,2022-03-06 15:17:28,"Dzień dobry,
prosimy o wysłanie zgłoszenia bezpośrednio z aplikacji, pod odpowiednim zamówieniem. Pozwoli nam to zająć się sprawą.
Pozdrawiamy",2022-03-19 17:47:06,1.18.1
a4c0b3c1-21f0-4bee-993e-bfde546dbc0a,Adrian Michalski,https://play-lh.googleusercontent.com/a/ACg8ocJEaFRjx6xpv2RdkmYBxlNxoead81-atVy88qCL20IL=mo,Mimo podania adresu pokazuje lokalizacje na środku osiedla przez co kurierzy krążą i szukają mojego bloku 30 minut.,1,5,1.18.1,2022-03-05 20:46:02,,,1.18.1
53932367-5d8c-40a2-8d02-d67607611baf,Kryx Krax,https://play-lh.googleusercontent.com/a/ACg8ocIn1lzrzYVWPseTTA6vX5wGfVOff53ju8usxMQFnfmQ=mo,"Czekałem prawie 2 godziny na zamówienie, które kurier odebrał ponad godzinę temu. Po kontakcie z biurem obsługi moje zamówienie zostało anulowane. Żenada...",1,0,,2022-03-03 00:18:11,,,
cc7dd419-7d37-46b4-9e3c-edd8115c1e6c,Mike Jensen,https://play-lh.googleusercontent.com/a/ACg8ocLH-mE7nh8hJmSArxq9EO2JSF5nx1WQn2nt5zWW13Hy=mo,Wyzyskiwacze,1,1,1.18.1,2022-03-02 19:09:06,,,1.18.1
082a0f26-7c14-403b-8e8b-675c69220b03,Sebastian M,https://play-lh.googleusercontent.com/a/ACg8ocLcoDS8na-nwCUcDkQEvWY5X96gXpxxW9k5JRm48Tt3=mo,Kurierzy jeżdżą jak chcą. Zamówienie opóźnione o 40min już drugi raz pod rząd.,1,7,1.18.1,2022-03-01 15:23:46,"Dzień dobry Panie Sebastianie,
prosimy o wysłanie zgłoszenia bezpośrednio z aplikacji, pod odpowiednim zamówieniem. Pozwoli nam to zająć się sprawą.
Pozdrawiamy",2022-03-19 16:00:55,1.18.1
2c4c2b8b-3843-45e9-a65d-d46955114cb1,Janusz S,https://play-lh.googleusercontent.com/a/ACg8ocJvr8xfNrWcMV0_3dcxBJu7awaYcweZDxSa-5B-gWr-=mo,Nie reklamujcie aplikacji jeżeli ma ona tylko wyświetlić że jestem poza obszarem dostaw.,1,9,1.18.1,2022-02-27 17:21:01,"Dzień dobry Panie Januszu,
bardzo nam przykro, że Pańska lokalizacja nie znajduje się aktualnie w obszarze dostaw. Mamy nadzieję, że już niebawem będziemy dostarczać jedzenie także w Pańskiej lokalizacji :-)
Pozdrawiamy",2022-03-19 14:23:42,1.18.1
533f81db-381c-4a60-b4d0-27e6d6227b43,Damian Wójcicki,https://play-lh.googleusercontent.com/a-/ALV-UjWPouoHzrZGgVcAfd2Aol-5V8__zktben2SVAS9sJKh6FU,"Wszystko było super, uwielbiałem zamawiac. Od czasu gdy kurier dostarczył moje jedzenie komuś innemu, a byłem bardzo głodny, to powiedziałem, że już nigdy więcej z tego nie skorzystam. Finalnie zwrócono mi srodki, ale bez żadnego przepraszam itp. Konkurencja zawsze dowozi pod wskazany adres. Wolę zapłacić trochę drożej, ale dostać swoje jedzenie. Proszę nie mylić z przewozami osób Bolt. Tam jak na razie jest super.",1,1,1.17.0,2022-02-24 19:08:45,"Dzień dobry Panie Damianie,
najmocniej przepraszamy za pomyłkę kuriera. Reagujemy na każde zgłoszenie, aby eliminować ryzyko powtórzenia się sytuacji takich jak opisana.
Pozdrawiamy",2022-03-19 12:43:42,1.17.0
4b8f79c2-a19b-4fcf-9677-bf88702a4f5a,Wiktoria Piszczek,https://play-lh.googleusercontent.com/a-/ALV-UjWdtNuH9YTrwT0Ft7C7V1evY4zMryIs9VeZeo8Y8gRBug,NIE MA DOSTAWY DO MNIE ŁEŁE😭,1,0,,2022-02-22 17:12:09,,,
74336c65-e227-4125-be78-6e69ebcf84a8,Filip C,https://play-lh.googleusercontent.com/a-/ALV-UjUme7OmUJ1OWYl1PIBQQcMBQfvDaD6yAc02LqKj2XKlZ8o,Dla zasady,1,3,1.17.0,2022-02-21 19:49:38,,,1.17.0
9dede3d2-04ad-424d-af0b-0b98e428a34b,Jakub kuś,https://play-lh.googleusercontent.com/a/ACg8ocLGMQcqKxqlCZ220xfYYhdje2X_SK-UTgQ2Af-C37YM=mo,Wysokie koszty dostawy. Dopłaty do niskiej zawartości koszyka.,1,0,,2022-02-20 17:48:55,"Dzień dobry Panie Jakubie,
zachęcamy do śledzenia promocji na dostawy w aplikacji :-) Restauracje mają określoną minimalną kwotę zamówienia.
Pozdrawiamy",2022-03-19 10:34:57,
ef491934-17be-4654-a015-192827c0517e,Tomasz Mirkiewicz,https://play-lh.googleusercontent.com/a-/ALV-UjWb1kl8FM1z3E0D1DOvqe3kZ4C5PoRJBnVuEzIYYdHsA0yI,"Coraz większe koszty, coraz mniejsze możliwości. Konkurencja niestety was wyprzedziła :/",1,4,1.17.0,2022-02-20 16:18:14,,,1.17.0
46e7335d-cc5d-4d4a-af9d-66197831798e,Paweł Kulpiński,https://play-lh.googleusercontent.com/a-/ALV-UjXtnC3yl6kjyNpjilIU38vJb7b2pHEqgL5vt3s7U2od9KA,"Uwaga, oszuści! Nie zwracają srodkow za brakujące elementy zamówienia.",1,0,,2022-02-19 21:44:52,,,
a593b6ac-717a-439a-b0a7-07cbe30c118f,Kinga N,https://play-lh.googleusercontent.com/a-/ALV-UjXGUUndyS3_uDzAI2Bj8z-pFEQfY1CU6D23sV34XPr0Tg0,Najgorsi kierowcy,2,4,1.17.0,2022-02-17 18:03:21,,,1.17.0
61c75e32-170f-4c2a-a2ed-3060b733121a,Kacper Krzesiński,https://play-lh.googleusercontent.com/a/ACg8ocKFYFKjg1U7rfikfZHZRwTSH66_9SkcEOEqj75f1B6q=mo,"Stale powiększająca się minimalna kwota zamówienia (ostatnio 28PLN, teraz 35) do tego co zamówienie rosnące opłaty za dostawę. Jeszcze pół roku temu najlepsza aplikacja do dostaw jedzenia na rynku, teraz konkurencji do pięt nie dorasta.",1,12,1.17.0,2022-02-15 18:01:04,,,1.17.0
e19a2fdd-1b18-400c-919a-a87d240cd441,Kamila,https://play-lh.googleusercontent.com/a-/ALV-UjWPy3BkpFnlywWIrlchyCGzhekHr0T2nJh2ZAvlcE9GdG0,"Nie można dodać swojej karty jako metody płatności, gotówki ani niczego innego też nie można wybrać. Co za tym idzie nie można zrealizować zamówienia.",1,9,1.17.0,2022-02-15 12:20:35,"Dzień dobry.
Bardzo proszę o wysłanie wiadomości przez aplikację Bolt (zakładka Wsparcie) lub na adres e-mail poland@bolt.eu, abym mogła pomóc rozwiązać powstały problem.
Pozdrawiam",2022-02-15 14:20:04,1.17.0
e6db7ce6-f905-49b7-925d-538b175e4e3d,Michal Sosna,https://play-lh.googleusercontent.com/a-/ALV-UjUEXCZHANY7yqRhFirXs6HcQpN2O2wN1q3jAe37yzLOZj0n,"Dostawa za dara okazuje się płatna (nie ma wyszczegolnionej min kwoty zamowienia), dopłata za zamowienie.... Kiepsko, odinstalowuje",1,7,1.17.0,2022-02-13 16:27:49,,,1.17.0
f676378d-aa35-4bcc-8e8e-18054b2cdc03,A S,https://play-lh.googleusercontent.com/a/ACg8ocJSt1gQGqmPX8Rv1hmhi8lpdVpbb9RvBlRSBJ73YjdZ=mo,2 godziny trwało dostarczenie jedzenia z restauracji która była oddalona odemnie o 3 km. Jak bym wiedziała to sama bym na piechotę poszła. Jakaś kpina. Apke odrazu po tym zdarzeniu usunęłam. Nie polecam,1,0,,2022-02-13 14:36:11,,,
8901911a-354e-4b0b-b16d-98527a973794,JD,https://play-lh.googleusercontent.com/a-/ALV-UjWWr1naRk9bEnbvrYK0buyko_STxkelqIHJUROe8l6suw,Dopłata 12zł to chyba jakaś kpina nie mam zamiaru tyle płacić,1,4,1.17.0,2022-02-13 12:50:34,"Dzień dobry.
Bardzo proszę o wysłanie wiadomości przez aplikację Bolt (zakładka Wsparcie) lub na adres e-mail poland@bolt.eu, abym mogła pomóc rozwiązać powstały problem.
Pozdrawiam",2022-02-16 16:22:25,1.17.0
56c9a143-ca09-4b40-9333-867ee06e3c8c,Beniamin Mulik,https://play-lh.googleusercontent.com/a-/ALV-UjVUP_EoxCGEfqYsvFre9Oi15GoGf-oBMPqZvQkN0_0BprM,Podniesienie minimalnej ceny zamówienia do 35 złotych to absurd.,1,7,1.17.0,2022-02-12 17:14:51,,,1.17.0
4a0d6ae0-103b-454b-8580-0d80a47e9686,BD „AaaKuKu” DB,https://play-lh.googleusercontent.com/a/ACg8ocLVa1jT225iIUbwJ8YZQ6mi9p7oQ-GSnIzjx1NUxdKI=mo,Startą czasu kasy i nerwów. Bardzo zle synchronizowana mapa dojazdów. Kierowcy nie przygotowani do klientów pod względem opłaty gotówkowej. Chcą jezdzic i rozmieniać. Klient który zamawia taxi. Musi. Dość sam do taksówkarza miec odlicza sume kwoty przejazdu. Podsumowując lepiej wyjdziecie na komunikacji miejskiej.,1,0,,2022-02-12 17:06:56,,,
b69335d1-6630-4432-9817-264fabe4db78,Pawel Modzelewski,https://play-lh.googleusercontent.com/a-/ALV-UjV0CocLo2xo4YP8RVMXvY-CJSCsElIpblUbjTDhKtFobOQ,Ciagle jakieś problemy są Albo zapomną czegoś albo wezmą nie to co trzeba,1,1,1.16.0,2022-02-10 17:31:40,,,1.16.0
b1ce930f-aa7f-4b84-a81e-41307dc334f2,Adrian Pogorzelski,https://play-lh.googleusercontent.com/a/ACg8ocLxEIoyHGOtroy6zbZpVH9s0OlasFbhQt8WCBqKcFCf=mo,"Dno, najgorsza aplikacja w tej kategorii. Cały model po prostu nie działa i wyłącznie stwarza problemy. W moim przypadku chyba połowa zamówień kończyła sie reklamacją. Ostatnio: jedzenie po raz kolejny przyjeżdża zimne. Po zgłoszeniu tego, kurier robi aferę, że ""przecież musiał pojechać najpierw do domu coś zjeść"", oczywiście po odebraniu zamówienia. Po zgłoszeniu tego zwykle następuje przerzucanie się winą między obsługą, a restauracją. Odinstalowane, odradzam.",1,0,,2022-02-10 11:46:57,,,
b94f208a-3c57-44d1-a66f-1b4554cf6b38,Nell G.,https://play-lh.googleusercontent.com/a-/ALV-UjXic6LEL8zznCo8wVHiKYPbKKRVjlpnqOXkieBfmPgBOtI,35 zł jako minimalna kwota zamówienia to gruba przesada.,1,4,1.16.0,2022-02-09 12:37:25,,,1.16.0
46011d76-ecad-4d5b-9e53-59dc1339b9d6,Michal 9935,https://play-lh.googleusercontent.com/a/ACg8ocKvVR8sL4bASknL3aGUTf0lPq-Eerbr0FFm7XmLehke=mo,Brak kontaktu.,1,4,1.17.0,2022-02-08 17:42:39,,,1.17.0
1ddc9691-5747-4c49-8d5d-f08d91c45585,Konrad g,https://play-lh.googleusercontent.com/a-/ALV-UjW6Yv3Vp-w-0qavH1-WZx3EJWNrri6ZcmSyNb52S1Q0Zpc,Brak płatności blik ??? Co to średniowiecze?,1,2,1.16.0,2022-02-07 18:16:23,,,1.16.0
04f6db22-e346-43a9-a426-901b5e22680d,Fabian Fabian,https://play-lh.googleusercontent.com/a/ACg8ocI9UN4PO7Ql7gGj3YogjXK9qvdkcg_KuvNk-WmkNIfg=mo,"Redłowo czyli prawie centrum Gdyni, a nie dowożą jedzenia",1,2,1.16.0,2022-02-07 03:13:24,,,1.16.0
789d98a7-41a6-413e-9767-20d161d876ce,Miriam Sikora,https://play-lh.googleusercontent.com/a-/ALV-UjX--EFAItUhk1ARrDJevJE6-wmFPT1ZDXY4-qeu16bkyA,"Wymuszanie zainstalowania aplikacji, bez możliwości sprawdzenia dowozu to strzał w kolano. Nie lubię takich zagrywek. Oczywiście do mnie nie dowozi a jestem z Krakowa 🤷🏻‍♀️",1,0,,2022-02-06 13:19:24,,,
7f73328c-b810-4714-b805-c5fa4d03971d,Elżbieta Skoczeń,https://play-lh.googleusercontent.com/a-/ALV-UjUOPHSBH2VgbFgyM3PCmYysyW6FTzCmMRWqJy90ZOHy1ww,Nie można z Wami kontaktu normalnego nawiązać :(jak zakupy chce zrobic:(,1,3,1.16.0,2022-02-06 11:53:41,"Pani Elżbieto, można się z nami skontaktować przez zakładkę Wsparcie.",2022-02-08 11:15:35,1.16.0
76a88913-0d76-47f2-a02a-80e2acba95cc,Wojciech Niewinowski,https://play-lh.googleusercontent.com/a-/ALV-UjVpQVJhs3t7G6cBrMOGXjAXvwxZZbcGkZYjYh-M3LFUIy8,Beznadziejna aplikacja. Brak jakiejkolwiek możliwości kontaktu z centrum pomocy. Push wyskakuje z informacją ale nie ma możliwości zobaczyć tych informacji w aplikacji. Nie polecam w bardzo łatwy sposób można stracić pieniądze.,1,1,1.12.5,2022-02-05 16:07:34,,,1.12.5
cf1d7a3d-e96e-4e40-8ced-9471e667368b,Tomasz Szlak,https://play-lh.googleusercontent.com/a/ACg8ocJhcB-bRUF2NDO751OkfeORXZ-kpJTIzCIsdzlIzayV=mo,Najgorsza aplikacja z jaką kiedykolwiek pracowałem. Wszystkim będę odradzał korzystanie.,1,2,1.16.0,2022-02-04 19:16:55,,,1.16.0
5699f66d-7d16-4bf9-bcca-50955b118308,Jakoniuk _,https://play-lh.googleusercontent.com/a-/ALV-UjVyPExye5VlbIFTxqlHa_Zp08LVP6Z-VErF2eKgxEyXM18,Nie dostałem mięsa w kebabach i odpisali mi że to nie możliwe niby,1,0,1.7.0,2022-02-04 09:16:50,,,1.7.0
5c6aeb6b-9506-4c1f-b3c5-66ad1140041f,Marcin Samson,https://play-lh.googleusercontent.com/a-/ALV-UjViCbp6SIo05UPLhC1LChlZxIlGizy2fxRkOhT07cPe3L0,"Wchodze i i nic ma, konta usunac nie mozna bo dalem swoje dane wiec takie aplikacje niszczyc w zarodku bo sa nie potrzebne na polskim rynku!",1,8,1.16.0,2022-02-02 19:50:47,"Dzień dobry.
Bardzo proszę o wysłanie wiadomości przez aplikację Bolt (zakładka Wsparcie) lub na adres e-mail poland@bolt.eu, abym mogła pomóc rozwiązać powstały problem.
Pozdrawiam",2022-02-02 20:18:27,1.16.0
b9000317-a1eb-420f-847a-3a6c0f8ab3c9,Nostea Schiffer,https://play-lh.googleusercontent.com/a-/ALV-UjWOZeYyU-kXd_LdJgeV6agm0mqy9oZnGycOCiw8EfJUzw,"Jeszcze w październiku zamawiałam przez ich stronkę jedzenie, zero problemów. Pod koniec stycznia, jak chciałam coś zamówić, nagle pokazało mi, że nie mam podpiętej karty. Niestety nie da się jej podpiąć, dane poprawnie wpisywane, pojawia się ""przetwarzanie danych"" po czym i tak karta nie jest podłączona. Po wielokrotnych próbach napisałam do nich o pomoc, rzekomo mieli przekazać sprawę do działu technicznego, ale od ponad tygodnia cisza, a apka dalej nie działa tak jak powinna. Szkoda",1,0,,2022-02-02 13:41:35,,,
ed1f2d4e-dc37-45c1-8a68-63766bff0499,Magdalena Góras,https://play-lh.googleusercontent.com/a-/ALV-UjVUX0pLc8ME-Hp_YqJfbriz9xDEtVJ9M81L_Q80eonCI0A,"Jedzenie dociera zimne, pomylone zamówienie i nie jasne menue. Pomimo wybranej opcji ""zostaw pod drzwiami"" dostawcy i tak tego nie robią.",1,1,1.15.0,2022-02-01 18:45:37,,,1.15.0
904626e0-5f73-467f-ad27-fdfe232a0795,Krzysiek Gromaszek,https://play-lh.googleusercontent.com/a-/ALV-UjUvKuI-Culsjm1USiMJAqoS8MZ_Avi3g_yjgFSyr8nZeyE,"Tragedia , nie pilecam uzywac tej apki, sa inne zdecydowanie lepsze",1,3,1.16.0,2022-02-01 18:06:03,,,1.16.0
02386075-6cd4-478b-8fdb-f5e87d621dd4,Ewa Kucharska,https://play-lh.googleusercontent.com/a-/ALV-UjUg0LXo3OI0x0Rh415L0gQUjyyTp4Vb4fuyQ_xVMwKpWhg,"Nie działają rabaty i znizki. Zle nalicza. Z xrugiej strony byl taki moment, ze wszystkim naliczala 50%rabatu",2,9,1.16.0,2022-02-01 12:42:48,,,1.16.0
cd642a69-15be-4bd9-9ac4-c8a4c58c230f,Lou,https://play-lh.googleusercontent.com/a-/ALV-UjXWL8WVviJKHXP7EUWUQehnI-HSsLHDZ8-bpGN3STxJ3Kg,Ładne promocje....tylko 12 zł opłaty jeśli zamówienie nie przekroczy 28 zł. Żarty jakieś.....,2,10,1.16.0,2022-01-28 18:48:13,,,1.16.0
14ff9110-5b3a-49d1-b073-881fa20803ae,Lesiu,https://play-lh.googleusercontent.com/a-/ALV-UjVTuKBTUAXIlaJdtAaxnbvl5VtzhTx6x8t9pnhr-1UD2yI,"Kurier jeździł przez pół godziny z moim zamówieniem po mieście, nawet nie w mojej okolicy, nie otrzymałem żadnych wyjaśnień - chociaż o nie prosiłem",1,31,1.16.0,2022-01-27 19:18:24,,,1.16.0
f6c79b8a-ef70-4e37-b388-7a8074f0f846,Tomasz Grzybek,https://play-lh.googleusercontent.com/a/ACg8ocKLnx5m4jmxtcGqESSWre6KvnNHvKQg6dzycmppz7vU=mo,"Lipa lipa jeszcze raz lipa, brak kodu za 1 zamówienie, ten ktory podaję nie działa, poza tym gdzie niby jest ta możliwość kontaktu z działem wsparcia z poziomu aplikacji?",1,2,1.15.0,2022-01-27 17:28:41,"Panie Tomaszu, wystarczy wejść w zakładkę wsparcie lub napisać na poland@bolt.eu",2022-02-07 15:47:12,1.15.0
